created_at,full_text,text_weight,text_weight_label,class_sentiment
Sun Dec 04 06:47:48 +0000 2022,work lolos seleksi admn ppk milu ajar darimana ya bingung cari tle ig yt bahas butuh materi penuh,-5,-1,negatif
Thu May 30 16:40:00 +0000 2024,waketum gerindra budi djiwandono partai kantong nama usung pilgub jakarta tuju koalisi indonesia maju,4,1,positif
Fri Apr 19 23:38:05 +0000 2019,disain sistem milu lacak potensi curang kacau milu evaluasi total kacau anggap berani mimpi buah milu ideal,1,1,positif
Sun Aug 21 23:28:34 +0000 2022,eks koruptor calon anggota dpr milu,-6,-1,negatif
Sun Apr 10 22:02:50 +0000 2022,promotor periode danatau tunda milu qodari,0,0,netral
Mon Jan 10 00:58:52 +0000 2022,ketua bkpm urus milu kepiye tolong fokus urus investasi bahlil kepala bkpm dunia usaha milu undur,8,1,positif
Wed Mar 02 01:48:44 +0000 2022,nyata biang tunda milu luhut binsar pandjaitan arti tunda milu agenda sembunyi perintah rakyat tolak periode nyata laku operasi senyap jabat,4,1,positif
Sat May 25 01:46:08 +0000 2024,mega partai kuasa moga catat pilih partai kuasa amburadul negara,0,0,netral
Sat May 25 09:45:07 +0000 2024,pdip jabar incar kursi cawagub pilgub jabar isi kader internal,8,1,positif
Tue May 28 01:42:04 +0000 2024,poin hasil rakernas pdip puan maharani milu buruk sejarah demokrasi indonesia,0,0,netral
Thu May 30 08:10:36 +0000 2024,ekonom senior politis kondisi ekonomi ri milu,-3,-1,negatif
Sun May 26 15:18:20 +0000 2024,megawati singgung buruk milu kpu bawaslu sunyi,-3,-1,negatif
Mon May 27 04:28:22 +0000 2024,opini sungguh cetek anak kandung anak tiri pilpres milu pilih pilpres presiden rakyat indonesia pilih kemarin presiden,-5,-1,negatif
Mon May 27 13:30:09 +0000 2024,mantan hakim konstitusi milu carut marut sidang mk,-7,-1,negatif
Thu May 30 10:07:28 +0000 2024,austerity bijak kondisi asersi sesat government spending pesat pilpres utama bansos bener misalokasi ujung kanibalisasi program social net,2,1,positif
Thu May 30 06:47:14 +0000 2024,eng ing eng mk gilir ma bikin sibuk nih,4,1,positif
Fri May 31 03:20:00 +0000 2024,cek identitas cantum daftar dukung calon orang pilkada coba cek,3,1,positif
Tue May 28 08:08:19 +0000 2024,demokrat cagub jakarta wawas global renanda bachtar mujiyono,0,0,netral
Sun May 26 10:34:26 +0000 2024,ketua dpp pdip puan maharani sanggup tahan tangis terima kasih rakyat indonesia helat pilpres,2,1,positif
Wed Jul 05 11:55:02 +0000 2023,wdyt orang tua anak pilih pilih milu sampesampe bilang daftarin sender sender milih hak sender ya pilih thanks,-8,-1,negatif
Wed May 29 06:15:50 +0000 2024,selamat sis sis yenny kristianti anggota pilih dprd kota bekas periode hadir kerja rakyat id,7,1,positif
Fri May 31 00:53:26 +0000 2024,fahami pura milu pilkada pilbup pilgubpilpres krn menang pesan oligarki kapitalis oknum aparat hianat lembaga survei quick count tayang tv mkpun sidang gugat pura pura id ri,4,1,positif
Sun May 26 07:56:33 +0000 2024,pdip milu buruk sejarah demokrasi indonesia,-5,-1,negatif
Sat May 25 21:04:32 +0000 2024,lbs rencana milu hancur pdi juang menang milu legislatif tanda rakyat percaya pdi juang,12,1,positif
Tue May 28 09:03:43 +0000 2024,sindir megawati pdip pilpres milu buruk sejarah demokrasi indonesia milu orde lepas pdip berani nyata partai oposisi,-6,-1,negatif
Fri May 31 08:37:00 +0000 2024,salah proses hitung suara laku habis berlarutlarut akibat saksi mandat partaipartai tps lelah fisik ist,9,1,positif
Mon Sep 30 05:35:43 +0000 2019,catat september ri periode besok oktober ri periode tanggal oktober lantik presiden ri periode hasil milu tugas sd,4,1,positif
Fri May 24 09:20:27 +0000 2024,rakernas v pdip megawati sorot curang milu,-5,-1,negatif
Fri May 24 11:52:05 +0000 2024,full pidato berapiapi megawati rakernas kev pdip ungkit milu putus mk,3,1,positif
Sun May 26 08:10:09 +0000 2024,rakernas v pdip puan milu buruk sejarah demokrasi indonesia,-5,-1,negatif
Tue May 28 14:20:25 +0000 2024,tum juang mega don keder nya teriak pilpre milu buruk tsm gua pilpres milu copy paste dri pilprespemilu,-11,-1,negatif
Fri May 24 09:33:34 +0000 2024,sorot duga curang milu tsm megawati ya,2,1,positif
Sat May 25 09:07:00 +0000 2024,pesan kritik pedas megawati tni polri nilai netral milu,-2,-1,negatif
Sun May 26 08:15:21 +0000 2024,milu laksana presiden ketua ri kadet juang,6,1,positif
Sun May 26 14:39:09 +0000 2024,harap masyarakat pilih prabowo milu pilih prabowo alih pilih anies prabowo nyata menang kontestasi pilpres,5,1,positif
Wed May 29 08:39:06 +0000 2024,sirekap pilkada serentak kpu ri tanggung,1,1,positif
Mon May 27 04:36:21 +0000 2024,juang klo ajuk hak angket ri hasil milu kontoversi amp dorong parlemen sah uu miskin koruptorpenyitaan aset berani juang,-4,-1,negatif
Sun May 26 00:50:05 +0000 2024,ri mampus suul khotimah bajing tengik rekayasa curang milu jabat pusat kepala desa,-9,-1,negatif
Sat May 25 16:28:47 +0000 2024,partai pdi p partai perintah omong serah pdi p uunya pdi p bicara milu curang kau kait move on wkwkwkwk woi statement ganjar mahfud dengar,1,1,positif
Sat May 25 10:49:35 +0000 2024,caleg pilih partai gerindra iwl alias indra cl alias christoper rupa kakak adik sangka money politics milu,4,1,positif
Sun May 26 09:59:54 +0000 2024,rakernas pdip milu buruk sejarah demokrasi,-5,-1,negatif
Sun Feb 11 15:59:38 +0000 2024,informasi lapang temanteman wni malaysia milu dapil negerimalaysia brutal coblos surat suara via pos ksk libat oknum kbri kjri selenggara awas milu ln brutal milu id ri,4,1,positif
Sun May 26 11:52:09 +0000 2024,rapat kerja nasional rakernas v pdi juang rumus sikap politik rumus nilai milu rupa milu buruk sejarah demokrasi indonesia,10,1,positif
Sat May 25 06:40:13 +0000 2024,pks masuk menang milu loh lumayan kursi ri kursi dpr,2,1,positif
Sun May 26 08:18:24 +0000 2024,singgung syarat nyapres pdip ajak sipilahli hukum evaluasi milu,5,1,positif
Sun May 26 07:41:33 +0000 2024,puan milu buruk sejarah demokrasi indonesia,-5,-1,negatif
Sun May 26 07:48:04 +0000 2024,pdip nilai milu milu buruk indonesia,0,0,netral
Sat May 25 03:35:00 +0000 2024,kliatany milu presd bikin konflik spt ukt mahasiswa lonjak bpjs facelift revisi uu tri n pers tarif ppn kompak gong pake konsep ubah susah rakyat sih,-3,-1,negatif
Sun May 29 05:20:04 +0000 2022,halo tolong bantu ngisi kuesioner kena sikap mahasiswa dukung proses milu rep ya dm thx u,15,1,positif
Sun May 26 13:33:06 +0000 2024,adi pasca kontestasi milu pdip sasar bullying kader nilai langgar etik raup menang,11,1,positif
Mon May 27 08:55:12 +0000 2024,bawaslu kritik megawati curang milu,-10,-1,negatif
Fri Nov 25 03:55:01 +0000 2022,tanyarl hai baca berita milu tolong isi kuisioner skripsi barter isi kuisioner titip,9,1,positif
Sun Aug 28 01:34:49 +0000 2022,milu presden sender arti nyoblos eh iya ktp nyoblos sumpah sangka banget l nyoblos presiden awokwokwok,11,1,positif
Thu May 30 08:00:21 +0000 2024,informasi milu buka upaya tingkat partisipasi percaya publik terap selenggara pilkada harap hasil pilih akuntabel transparan,22,1,positif
Fri May 24 12:13:33 +0000 2024,milu nilai buruk sejarah curang langgeng praktik penyalahgunaan kuasa,2,1,positif
Wed Feb 14 11:24:53 +0000 2024,website id down akses real count paksa mempercayai hasil quick count rupa sample real vote hmmm,6,1,positif
Mon May 27 02:10:37 +0000 2024,tonton sidang phpu lihat konsisten lemah wakil perempuan milu lupa sejarah wakil perempuan milu lemah institusi demokrasi kpu,11,1,positif
Sat May 25 03:22:44 +0000 2024,andai ganjar menang milu jujur amp terbersih era merdeka tolok ukur kalah menang,18,1,positif
Fri May 24 16:00:16 +0000 2024,ketua pdip megawati bicara perintah otoriter populis legal otokratis hasil curang milu,-2,-1,negatif
Sun May 26 07:55:17 +0000 2024,pdip nilai penyalahgunaan kuasa aparat tegak hukum milu,8,1,positif
Fri May 24 09:44:58 +0000 2024,megawati tuding milu curang struktur sistematis masif,-3,-1,negatif
Tue May 28 09:47:34 +0000 2024,blakblakan ridwan kamil pilih komeng milu alas lucu,4,1,positif
Sun Jan 22 20:05:00 +0000 2023,guys no salty terima pps milu sanggup ngundurin ya,9,1,positif
Sat Feb 03 08:56:40 +0000 2024,bpk rektor prof satria maklum nyata bpk posisi politik bpk salam rektor ipb veto suara kampus selamat bangsa bpk tuduh kampus suasa rusak,20,1,positif
Sat May 25 08:08:40 +0000 2024,id ri nakula anakkolong sauya ogi kacung sih samsul milu kpk atur mk ketiak paman usman,4,1,positif
Mon May 27 00:45:30 +0000 2024,megawati singgung buruk milu kpu bawaslu sunyi,-3,-1,negatif
Fri May 24 12:35:54 +0000 2024,megawati perintah kader pdip takut suara curang milu,-2,-1,negatif
Fri May 24 09:04:34 +0000 2024,megawati ungkit laksana milu anggap kandung curang struktur sistematis pidato rakernas pdip,-5,-1,negatif
Mon Oct 03 04:27:19 +0000 2022,bravo putus berani selamat mas dinamika demokrasi pks insya allah putus mejelis syuro,19,1,positif
Wed May 29 09:59:00 +0000 2024,hut kppg bal gelar fashion show sarana relaksasi pasca milu,4,1,positif
Thu May 30 08:14:13 +0000 2024,pdi juang provinsi papua selatan raih kursi milu raih kursi kursi dprd provinsi papua selatan,7,1,positif
Sat May 25 14:07:40 +0000 2024,klo dihubungkan temu ppatk alir dana kampanye milu sumber tambang ilegal hambat tuntas tambang illegal kait erat dana kampanye milu parpolcalegcapres aparat hukum hak bukti,12,1,positif
Mon May 27 06:00:02 +0000 2024,ulas catat selenggara milu pilkada,3,1,positif
Tue May 28 22:37:33 +0000 2024,partai politik milu sembilan hasil emas kursi legislatif total kursi dprd bangka belitung,2,1,positif
Fri May 31 07:41:14 +0000 2024,kursi partai dprd sumatera utara hasil milu,3,1,positif
Thu May 30 02:29:50 +0000 2024,anggota parlemen israel netanyahu gagal seruk milu,-10,-1,negatif
Mon May 27 08:12:06 +0000 2024,aswanto orang mesti milik dukung partai politik anggota lembaga selenggara milu,-2,-1,negatif
Fri May 31 11:18:08 +0000 2024,dorong zulhas pimpin pan pasha piawai uji milu dasar,1,1,positif
Wed Feb 14 06:00:23 +0000 2024,serba serbi milu recap jenis drama kalang tweet update besok a thread,-4,-1,negatif
Wed Feb 14 13:00:08 +0000 2024,serbaserbi selamat prabowogibran,8,1,positif
Wed Feb 14 06:41:00 +0000 2024,lapor warga surat suara coblos fakta amp bukti curang quick count ambisi menang curang,-4,-1,negatif
Thu Feb 15 03:57:47 +0000 2024,serba serbi golput milu a threas,0,0,netral
Tue Feb 20 07:25:45 +0000 2024,ya allah ikan turun ketua kpu ri bawaslu amanah selenggara milu ya allah laknat amp azab kpu bawaslu adil jalan tugas negara aamiiin yaa robbal,20,1,positif
Tue May 28 14:06:25 +0000 2024,iya milu hibur,0,0,netral
Wed Feb 14 08:14:07 +0000 2024,dear pilih aceh anggap kau berani,0,0,netral
Thu Feb 15 03:31:24 +0000 2024,serbaserbi momen lucu indonesia btw selamat prabowogibran a thread,11,1,positif
Sun Jun 02 11:15:10 +0000 2024,forum silaturahim saksi pks milu sukses gelar rajeg,12,1,positif
Wed Apr 24 15:08:28 +0000 2024,alhamdulillah prabowogibran resmi kpu presiden wakil presiden pilih periode terima kasih rakyat indonesia selenggara milu tokoh agama prajurit tni polri rawan rekanrekan pers,12,1,positif
Sun May 26 23:05:31 +0000 2024,milu tantang nyata jelang pilkada lintas agama jaga utuh harmonis masyarakat indonesia polisi yaman melon madura mei,5,1,positif
Thu May 30 03:01:11 +0000 2024,janji kampanye prabowo milu sehat bayar subsidi listrik subsidi bbm sekolah bayar angkut bikin negara angkut subsidi nggedabrus,14,1,positif
Wed May 31 09:30:26 +0000 2023,kemarin dengar aspirasi khawatir masyarakat kait milu netral fair harap milu jalan sesuai prinsip demokrasi jujur adil hak,21,1,positif
Wed Dec 13 10:59:40 +0000 2023,fyi milu tanggal februari sesuai feng shuinya kalender sinar mas sial gws,-4,-1,negatif
Wed Feb 14 05:08:09 +0000 2024,alhamdulillah iriana laksana pilih milu presiden amp wakil presiden ri dpr ri dpd ri drpd provinsi dprd kota pungut suara tps camat gambir jakarta pusat rabu februari pk,16,1,positif
Mon Jan 29 12:03:08 +0000 2024,jejaring oligarki tambang lingkar caprescawapres milu surya paloh politikus usaha bisnis media properti catering rambah sektor tambang energi surya anak prananda paloh usaha tambang,2,1,positif
Wed Feb 14 05:19:39 +0000 2024,bapa gue ngakak banget tps disurakin pilih gemoy ya garagara pakai kaos biru also bapa iyahhh bwoong,3,1,positif
Thu Feb 15 06:34:58 +0000 2024,gue buka timeline isi drama milu,1,1,positif
Fri Mar 15 08:40:55 +0000 2024,artis iklan judi online maju kandidat anggota dpr ri milu artis iklan judi online deklarasi dukung pasang calon paslon presiden simak rincian,12,1,positif
Sat Jan 06 06:27:19 +0000 2024,milu satunya partai sandera kuasa pks,3,1,positif
Wed Feb 14 06:18:47 +0000 2024,lihat hasil quick count via website unggul provinsi papua papua daerah indonesia erat isu ham unik tarik,7,1,positif
Sun Dec 10 12:18:20 +0000 2023,temanteman x milu ribu warga jakarta timur pilih rian angka besaarr milu rian ubah rian simak video,1,1,positif
Sun Jun 02 08:23:53 +0000 2024,kampanye milu meksiko tewas puluh politis calon wali kota bunuh kampanye september jelang milu minggu kandidat tewas kreatif aditya jaya iswara,13,1,positif
Wed Feb 14 09:12:16 +0000 2024,ayo fokus fokus input data qc internal amin kpu lapor pungut suara tps milu titik tps negeri tps negeri an tps tps,11,1,positif
Sat Jun 01 05:00:08 +0000 2024,pdi juang provinsi kalimantan raih kursi milu raih kursi kursi dprd provinsi kalimantan,7,1,positif
Wed Jul 05 11:20:02 +0000 2023,tw politik umur besok milu ayah bebas pilih aja trik tipsnya kak bingung buzzer enyah,-6,-1,negatif
Fri Apr 19 03:35:49 +0000 2024,demo tolak intervensi milu patung kuda tempofebri angga palguna,-10,-1,negatif
Thu Feb 01 09:00:35 +0000 2024,ajar politik global universitas murdoch australia ian wilson ramal prabowo subianto bawa rezim otoriter hasil menang milu buah opini terbit fulcrum ian tulis popularitas prabowo angin,8,1,positif
Tue Feb 13 13:31:34 +0000 2024,aksi mahasiswa gedung selasa bubar gerombol orang dikenalpreman intimidasi mahasiswa kirim kaji curang milu dirty vote nyata,-1,-1,negatif
Thu May 30 02:29:29 +0000 2024,kepala daerah koordinasi wujud pilkada damai,3,1,positif
Wed Feb 14 11:41:34 +0000 2024,si tukang kayu solo menang pilkada solo menang pilkada solo menang pilgub jakarta menang pilpres menang pilpres menang pilpres menang tokoh hebat sejarah milu indonesia,32,1,positif
Fri May 31 09:41:59 +0000 2024,anggota kpu betty epsilon idroos arah rapat koordinasi evaluasi aman informasi milu kesiap infrastruktur tahap pilih rabu,0,0,netral
Sun Apr 10 10:50:41 +0000 2022,sepakat milu laksana februari pilkada november tahap milu juni april kpu bawaslu periode lantik milu pilkada serentak,10,1,positif
Wed May 29 03:05:10 +0000 2024,ketua kpu hasyim asyari terangterangan laku jahat milu tangkap hasyim asyari feri amsari bukti surat kpu pusat kpu daerah laku curang milu,-12,-1,negatif
Sat Dec 02 17:54:39 +0000 2023,ga harap milu indonesia gini aja,4,1,positif
Thu Feb 15 15:02:55 +0000 2024,twit zarry proses milu akun bravo zar,1,1,positif
Sun Oct 15 09:35:03 +0000 2023,milu kelean ktp masuk pilih gen,-5,-1,negatif
Thu Feb 15 05:48:38 +0000 2024,tim menang nasional tpn ganjarmahfud rencana buka peluang komunikasi timnas amin usut curang milu wakil ketua tpn jendral purn tni andika perkasa posko menang teuku umar jakarta rabu,13,1,positif
Sun Feb 04 08:21:21 +0000 2024,menang milu presiden indonesia,7,1,positif
Wed Feb 14 11:02:31 +0000 2024,anies baswedan tanggap hasil quick count pilpres,6,1,positif
Mon Feb 12 17:39:07 +0000 2024,ramal anak indigo capres menang milu,-1,-1,negatif
Thu Mar 16 21:53:47 +0000 2023,gilak gilak chatgpt sy perintah sesi tulis kreatif purapura orang evil mastermind plot rencana tunda milu indonesia perintah dpr bikin operasi singgah,-3,-1,negatif
Tue Feb 27 09:40:52 +0000 2024,ikan buntal milu jurdil langgar indikasi jujur moga allah turun malapetaka sakit ngeri komisioner ri gaji pakai uang rakyat uang asam sulfat,-3,-1,negatif
Fri Feb 16 14:33:14 +0000 2024,badan awas milu bawaslu nyata pungut suara tps potensi laku pungut suara ulang psu milu ketua bawaslu rahmat bagja temu pilih hak pilih kali,7,1,positif
Mon Feb 12 13:55:49 +0000 2024,senin februari ketua kelompok selenggara pungut suara kpps undang hak pilih milu tps lurah gambir lokasi gedung lembaga administrasi negara jalan veteran nomor jakarta,0,0,netral
Sun Jun 02 02:17:42 +0000 2024,kpu provinsi sumatera utara gelar selenggara rakor rapat koordinasi evaluasi kelola logistik milu bahas progres susun lapor tata kelola logistik milu laksana tanggal sd mei,10,1,positif
Thu Feb 15 15:05:32 +0000 2024,markupnya maen suara diinput teriak curang link,-2,-1,negatif
Sun Sep 03 00:45:24 +0000 2023,jadwal tahap selenggara milu kpu calon presiden wakil presiden jadwal tanggal oktober november tanggal september tanggal,-3,-1,negatif
Tue May 28 01:26:30 +0000 2024,hasyim asyari terangterangan laku jahat milu tangkap hasyim asyari feri amsari bukti surat kpu pusat kpu daerah laku curang milu,-12,-1,negatif
Wed Feb 14 15:24:37 +0000 2024,cobak guru matematika muntaber kalo kasih lihat,8,1,positif
Mon Apr 11 06:16:13 +0000 2022,milu februari pilkada serentak november butuh anggar rp triliun kpu rp triliun bawaslu rp triliun hitung detail apbn apbd tahap,4,1,positif
Sun Nov 12 12:09:43 +0000 2023,tuju buk megawati milu milu rakyat intimidasi milu curang,-7,-1,negatif
Thu Mar 14 06:52:31 +0000 2024,manghadiri acara diskusi pasca milu gelar koresponden asing jakarta foreign correspondents club jfcc media internasional pantau milu indonesia update sumber kemarin undang,6,1,positif
Sat May 06 07:04:31 +0000 2023,milik kuasa republik rakyat milu hilang kuasa pindah kuasa kuasa sejati pindah pindah ganti wenang jalan kuasa,28,1,positif
Wed Aug 17 11:12:23 +0000 2022,allah sih benci arab arab negara banget politik identitas milu tukang hoax tsk rela bikin hoax junjung dki jakarta sukses pakai politik identitas tagih,-1,-1,negatif
Tue Apr 23 10:35:12 +0000 2019,staff psi anak muda hebat juang jam gembira psi kalah tangis anakanak juang sepenuh hati siang kumpul makan acara ketua pesan juang milu,5,1,positif
Tue Dec 19 07:41:24 +0000 2023,ide cuti februari februari libur isra miraj februari cuti imlek weekend ngajuin cuti libur milu ngajuin cuti weekend libur februari ngajuin cuti dapetnya,24,1,positif
Mon May 27 04:03:03 +0000 2024,mari wujud pilkada jakarta bersih martabat,11,1,positif
Mon May 27 04:03:02 +0000 2024,beda pilih mari jaga rukun,2,1,positif
Mon May 27 04:33:59 +0000 2024,rakernas v partai nilai milu rupa milu buruk sejarah demokrasi indonesia penyalahgunaan kuasa intervensi aparat tegak hukum langgar etika penyalahgunaan sumber daya negara puan,6,1,positif
Mon May 27 04:03:03 +0000 2024,jaga kebhinekaan,2,1,positif
Wed May 29 04:23:35 +0000 2024,ketua badan menang milu bappilu dpp partai nasdem prananda surya paloh serah surat rekomendasi enam kader internal maju kontestasi pilkada november enam kader internal rekomendasi partai nasdem,3,1,positif
Tue Oct 17 13:48:55 +0000 2023,ganjar menang madura cawapresnya prof dr h mohammad mahfud mahmodin sh su mip tuju mahfud cawapresnya ganjar milu rt keras,17,1,positif
Sun Jun 02 00:34:28 +0000 2024,breaking claudia sheinbaum prediksi presiden perempuan yahudi meksiko milu mexico langsung minggu komunitas yahudi cakup populasi meksiko kakek nerupakan imigran,14,1,positif
Fri May 31 23:28:44 +0000 2024,kampanye aman damai sejuk fokus utama cipta iklim politik kondusif penuh toleransi pasca milu mari harga beda pendpt mengormati beda pilih riza sarasvita jan ethes enakeun twtw aja mahkamah,4,1,positif
Sun May 26 11:43:37 +0000 2024,presiden pilih milu prabowo subianto janji presiden rakyat indonesia wakil gibran rakabuming raka usaha keras maju indonesia kalah bangsa sibuk menteri,5,1,positif
Wed May 29 02:54:59 +0000 2024,podcast kpu ri tayang kali tayang tamu jurnalis milu tau seru ya tonton podcast kpu ri episode vitorio mantalean berita milu tayang perdana rabu tanggal mei,2,1,positif
Thu Mar 21 12:18:21 +0000 2024,nama pasang prabowo subianto gibran rakabuming raka nama koalisi indonesia maju terima kasih harga setinggitingginya rakyat indonesia hak pilih milu terima,11,1,positif
Wed Feb 14 18:00:53 +0000 2024,contoh salah tps tapanuli utara suara markup suara link,0,0,netral
Sun Sep 17 11:27:16 +0000 2023,beneran partai milu diselundupin intel agustus anggota tibatiba dichat orang gabung partai pas cek nomor getcontact nyata anggota ormas indikasi afiliasi bin,-1,-1,negatif
Tue May 28 12:21:22 +0000 2024,dpp partai nasdem selesai gelar rapat pleno badan menang milu bappilu kader internal maju pilkada rekomendasi pimpin langsung ketua bappilu dpp prananda surya paloh enam kader internal rekomendasi partai,9,1,positif
Tue Nov 28 03:08:45 +0000 2023,resmi kampanye milu nov feb,5,1,positif
Sat Sep 16 03:40:00 +0000 2023,karna milu dominasi pilih muda moga pemuda bijak pilih ges,3,1,positif
Fri May 24 14:40:28 +0000 2024,rapat kerja nasional rakernas v pdi juang selenggara ancol jakarta utara megawati soekarnoputri utara resah kritik perihal laksana milu ideal hias curang sanasini,0,0,netral
Thu May 30 13:15:00 +0000 2024,pks parpol raih suara milu wilayah jakarta amp kota sangga ibukota daya tawar pks gabung perintah prabowo lengkap simak youtube kompastv,-1,-1,negatif
Mon May 27 07:39:04 +0000 2024,kampus merdeka pkb,0,0,netral
Thu Feb 15 12:37:31 +0000 2024,update data hitung suara pilih presiden himpun website resmi kpu februari wib anies baswedanmuhaimin iskandar prabowo subiantogibran rakabuming ganjar,5,1,positif
Thu Mar 21 05:49:02 +0000 2024,komisi pilih kpu rampung rekapitulasi suara milu rabu maret nama caleg artis prediksi lolos senayan aman kursi dpr ri mayoritas artis lolos anggota dpr ri periode debut,2,1,positif
Sat May 25 09:30:12 +0000 2024,pdi juang kabupaten ogan komering ilir raih kursi milu raih kursi kursi dprd ogan komering ilir,7,1,positif
Sat May 25 23:57:24 +0000 2024,megawati tum pdip milu abuabu direkyasa kuasa mk politik praktis kuasa kuasa laku tsm tni polri tarik politik praktis akibat kader teriak nama jokowi laku,16,1,positif
Sun May 26 23:30:02 +0000 2024,milu tantang nyata jelang pilkada lintas agama jaga utuh harmonis masyarakat indonesia polisi yaman melon madura mei,5,1,positif
Mon May 27 01:02:08 +0000 2024,lintas agama pasca milu jelang pilkada milu jelang pilkada lintas agama jaga utuh harmonis masyarakat indonesia polisi yaman melon madura mei,5,1,positif
Sun May 26 12:00:16 +0000 2024,pdi juang kabupaten nias selatan raih suara milu raih kursi kursi dprd kabupaten nias selatan,9,1,positif
Thu May 23 12:05:08 +0000 2024,pdi juang kota pematang siantar raih kursi milu raih kursi kursi dprd kota pematang siantar,-3,-1,negatif
Sun May 26 08:11:12 +0000 2024,pdiperjuangan nilai milu rupa milu buruk sejarah demokrasi indonesia penyalahgunaan kuasa intervensi aparat hukum politik uang ketua dpp pdip puan maharani minggu rir,5,1,positif
Sun May 26 04:17:58 +0000 2024,ustadguru lgbt rael anti perempuan suka pantt laki laki wajib basmi bumi aceh hukum ringan lihat bebas timses milu aceh kriminal pakai agama rusak anakanak aceh please stop it,-2,-1,negatif
Sat May 25 13:15:08 +0000 2024,pdi juang kabupaten pulau meranti raih kursi milu kursi raih kursi kursi dprd kabupaten pulau meranti,7,1,positif
Sun May 26 23:45:37 +0000 2024,pilkada momentum elemen masyarakat jalin konsolidasi sosial pasca milu matang laksana pilkada harap polisi yaman melon madura mei,13,1,positif
Thu Feb 22 06:58:21 +0000 2024,subianto mas tweet partai gerindra terimakasih sebesarbesarnya penyelanggara milu komisioner kpu tugas kpps saksi awas milu bawaslu aparat tegak hukum tni,9,1,positif
Fri May 31 00:48:34 +0000 2024,tantang profesionalisme selenggara milu selenggara milu independen profesional rupa salah syarat wujud milu integritas tumbuh profesionalisme champions league milik kakak hutama karya kiky kaesang,7,1,positif
Thu May 30 10:50:12 +0000 2024,tweet simple rangkul duduk bangun bangsa ajak kerja ya minimal ribut tonton aja cc indonesia,5,1,positif
Thu Feb 22 13:50:34 +0000 2024,nasdem pkb pks kompak dukung hak angket curang milu partai nasdem pkb gabung koalisi ubah nyata sikap dukung wacana hak angket gulir dpr ri usut duga curang milu sikap dukung,2,1,positif
Sun Dec 04 04:56:07 +0000 2022,seleksi ppk milu seleksi tulis diumumin ya lokasi bingung cari info mohon bantu temanteman work,3,1,positif
Sat Jun 01 22:27:06 +0000 2024,halo jadwal sidang periksa duga langgar kode etik selenggara milu kepp laku juni,0,0,netral
Thu Feb 22 14:42:45 +0000 2024,kemarin terima surat selamat presiden turki kena hasil milu langsung duta turki terima kasih dukung sahabat negara,25,1,positif
Tue Feb 13 12:54:00 +0000 2024,presiden joko widodo resmi tunjang kerja tukin pegawai bawaslu jelang milu atur presiden nomor tukin sesuai kelas jabat tukin kelas jabat capai rp,18,1,positif
Sun May 26 06:10:37 +0000 2024,halo cari anak sma jogja pmilu kemarin pilih kali n rasumber skripsku nih teman teman sedia komen ya ku diem makasiii,1,1,positif
Mon Feb 12 09:01:57 +0000 2024,wakil presiden ma ruf amin saran perintah hati kritik film dirty vote kena curang milu,-2,-1,negatif
Wed Feb 14 14:00:02 +0000 2024,the legend maju partai ga kampanye gedean pose beda kertas suara man of the match milu please welcome the real legend alfiansyah bustami alias komeng,8,1,positif
Wed Jan 24 03:00:06 +0000 2024,calon presiden nomor urut anies baswedan presiden jokowi jatuh sanksi hadap menterimenteri sikap netral milu,9,1,positif
Mon May 27 04:03:04 +0000 2024,yuk sukses pilkada aman damai,7,1,positif
Thu May 30 13:47:10 +0000 2024,kaca pilpres kakak kaesang gibran usia maju cawapres mk syarat calon presiden wakil presiden pasal huruf ku uu nomor milu,2,1,positif
Sun May 26 09:45:10 +0000 2024,momen puan maharani kuat tahan air mata baca poin rekomendasi eksternal hasil rakernas v pdip puan tangis maaf rakyat indonesia kader langgar konstitusi milu terdzolimi,5,1,positif
