created_at,full_text,text_weight,text_weight_label,class_sentiment
Mon Mar 11 10:20:21 +0000 2024,pawai main issu lempar batu sembunyi tangan n alam sutradara playing fictim plus quick count,6,1,positif
Fri Mar 22 00:30:00 +0000 2024,banding hasil kpuquick count csis pilpres selisih pileg banding hasil resmi kpu quick count pilprespileg lembaga csis gtgt,7,1,positif
Sun Mar 24 07:00:05 +0000 2024,quick count pilpres lembaga survei akurat hasil kpu,0,0,netral
Thu Mar 21 04:55:00 +0000 2024,kpu prabowogibran menang pilpres banding hasil resmi kpu quick count kah beda,10,1,positif
Thu Mar 21 09:35:00 +0000 2024,banding hasil resmi kpu quick count pileg lembaga hasil beda,6,1,positif
Wed Mar 06 05:39:15 +0000 2024,heran suara psi dadak lesat sahroni nasdem quick count salah hitung ilmiah salah input,2,1,positif
Tue Mar 05 06:46:34 +0000 2024,suara partai milu versi quick count real count,4,1,positif
Fri Mar 01 04:30:33 +0000 2024,wib februari data masuk capai terima kasih partisipasi dukung antusiasme masyarakat rangkai giat quick count csis indonesia x cyrus network,8,1,positif
Tue May 07 12:00:21 +0000 2024,indikator politik rilis hasil quick count pileg hasil partai pdip golkar gerindra,8,1,positif
Wed Feb 21 02:22:58 +0000 2024,hasil quick count lembaga survei pilpres,0,0,netral
Thu Mar 21 11:01:05 +0000 2024,hasil quick count pileg csis indonesia cyrus network milik selisih ratarata,0,0,netral
Thu Feb 29 06:04:36 +0000 2024,hasil quick count milu picu polemik hitung percaya,9,1,positif
Thu Mar 21 04:13:06 +0000 2024,hasil rekap pilpres kpu quick count,3,1,positif
Wed Mar 20 23:19:34 +0000 2024,banding hasil pilpres dasar data real count kpu quick count lembaga survei,2,1,positif
Fri Mar 15 14:43:06 +0000 2024,wakil ketua prabowogibran silfester matutina hasil quick count rekapitulasi kpu prabowogibran menang,7,1,positif
Sun Mar 10 13:52:35 +0000 2024,tum airlangga apresiasi pimpin aseanaustralia quick count pilpres,0,0,netral
Thu Mar 07 04:11:21 +0000 2024,beda signifikan hasil kpu quick count nilai indikasi curang,3,1,positif
Tue Mar 19 06:12:32 +0000 2024,forum akademika beda hitung suara hasil rekapitulasi pilih milu hasil hitung cepat quick count sistem informasi rekapitulasi sirekap timbul debat,9,1,positif
Fri Mar 22 07:00:07 +0000 2024,lsi denny ja nilai akurat kait quick count hasil pilpres,9,1,positif
Wed Apr 24 08:09:29 +0000 2024,barusan update data lagulagu karya publisher nyata lagu april emang real count lho quick count manipulasi wkwkwk tunggu orang cibir pandemi challenge bikin karya,7,1,positif
Wed Apr 03 08:33:31 +0000 2024,profesor it hitung kpu quick count beda persen,1,1,positif
Mon Mar 04 05:41:23 +0000 2024,ahmad sahroni kpu hitung ulang sirekap milu psi gegara suara janganjangan itungan quick count,0,0,netral
Thu Mar 21 09:13:12 +0000 2024,gibran kerap selamat hasil quick count prabowogibran unggul,8,1,positif
Tue Mar 05 02:53:14 +0000 2024,sabar prabowo subianto buah hasil menang pilpres versi quick count hebat,14,1,positif
Thu Mar 21 09:09:34 +0000 2024,denny ja selisih quick count kpu persen,-2,-1,negatif
Tue Feb 20 21:25:28 +0000 2024,capres anies baswedan masuk putar pilpres kalah quick count real count kpu tinggal,-4,-1,negatif
Wed Feb 21 08:04:39 +0000 2024,viral video anies baswedan quick count analogi sampel darah,4,1,positif
Fri Mar 22 08:15:02 +0000 2024,lsi denny ja lembaga survei quick count akurat pilpres,-3,-1,negatif
Mon Mar 04 03:36:45 +0000 2024,benarbenar suara psi beda prediksi quick count quick countnya salah kpunya manipulasi gelembung suara lembaga survei smrc,-2,-1,negatif
Wed Mar 06 09:09:36 +0000 2024,nasdem ajak parpol usung pasang prabowogibran dukung hak angket dpr legitimasi menang hasil quick count,16,1,positif
Sun Mar 10 20:03:55 +0000 2024,kpu ri haallooo id sd ruang hampa selamat presiden republik indonesia pilih versi quick count real count mhd,0,0,netral
Fri Feb 16 07:42:24 +0000 2024,real count internal bukti suara prabowo capai timnas amin maju putar,8,1,positif
Wed Apr 03 10:25:00 +0000 2024,ya putus kpu gugat diskualifikasi hasil rekap real count milu milu bener buruk buruk lawan kalah kayak nih paslon amp sih suara,1,1,positif
Fri Feb 16 17:44:40 +0000 2024,lanjur klaim menang tim prabowo tegang suara real count kpu,9,1,positif
Fri Feb 16 12:30:15 +0000 2024,aniesmuhaimin unggul suara suara persen,6,1,positif
Wed Apr 03 10:25:00 +0000 2024,ya diskualifikasi hasil rekap real count milu relevan diskualifikasi,9,1,positif
Wed Apr 03 10:30:00 +0000 2024,diskualifikasi hasil rekap real count milu kayak nih paslon amp sih suara,4,1,positif
Wed Mar 20 15:18:14 +0000 2024,kpu resmi hasil real count pilpres rabu caprescawapres prabowogibran raih suara caprescawapres aniesimin raih suara caprescawapres ganjarmahfud raih suara dok,23,1,positif
Wed Mar 20 02:38:34 +0000 2024,update hasil real count pilpres selasa maret aniesimin prabowogibran ganjarmahfud sila klik taut baca prabowomenang buatbangsa,11,1,positif
Wed Mar 20 16:41:05 +0000 2024,breaking news kpu ri hasil real count milu rabu,5,1,positif
Wed Apr 03 10:29:29 +0000 2024,emang paslon amp nurul banget jalan pikir tuntut diskualifikasi paslon unggul hasil rekap real count milu tweet menang,8,1,positif
Wed Apr 03 10:25:00 +0000 2024,putus kpu gugat diskualifikasi hasil rekap real count milu kayak nih paslon amp sih suara pokok dukung mas tweet,14,1,positif
Wed Mar 13 10:25:09 +0000 2024,selamat orang tweet menang lihat hasil real count milu,17,1,positif
Mon Mar 18 06:07:01 +0000 2024,tanggal februari omong media tunggu hasil real count kpu beda rekapitulasi jenjang sih kapten perintah saksi tolak hasil rekapitulasi saran keruh fakta,-9,-1,negatif
Sun Mar 17 05:42:41 +0000 2024,real count pilpres sctv tayang suara aniesmuhaimin persen fakta lansir situs kabar maret kemarin suara prabowogibran unggul suara,12,1,positif
Wed Mar 20 15:31:00 +0000 2024,selamaatt pasang presiden wakil presiden pilih amp tweet komisi pilih ri id hasil real count milu rabu dasar hasil rekapitulasi suara pilpres liput,19,1,positif
Wed Feb 14 11:24:53 +0000 2024,website id down akses real count paksa mempercayai hasil quick count rupa sample real vote hmmm,6,1,positif
Fri Mar 15 14:17:06 +0000 2024,real count amin unggul cuplik video suara pilpres provinsi sumatera barat suara nasional lengkap,11,1,positif
Fri Mar 15 07:45:00 +0000 2024,milu duniaucapkan selamat hasil real count pungkiri unggul cipta paslon paslon lai lengkap baca,15,1,positif
Wed Mar 20 14:21:45 +0000 2024,breaking news detikdetik kpu hasil real count milu menang,9,1,positif
Fri Mar 15 10:20:34 +0000 2024,keren banget loh nyata kalo tweet menang pilpres bukti hasil real count kpu,11,1,positif
Tue Mar 12 10:15:59 +0000 2024,sih gerak jalan rame viral,2,1,positif
Mon Mar 18 12:14:32 +0000 2024,kpu mangkir sidang kip real count server milu,0,0,netral
Mon Mar 18 16:47:10 +0000 2024,anies menang pilpres sumbar coba test pilkada sumbar menang real count pilpres sumbar anies menang daerah prabowo,16,1,positif
Mon Mar 18 08:39:26 +0000 2024,kpu mangkir sidang kip real count server milu,0,0,netral
Thu Mar 21 10:36:31 +0000 2024,hasil tps akurat sampel tps sampel pilih selisih quick count lsi denny ja real count pilpres kpu ri lengkap,1,1,positif
Wed Mar 20 16:47:08 +0000 2024,sah kpu rilis real count pilpres selamat prabowo subianto presiden pilih periode moga amanah program kerja tampil bodoh pampang nyata pr komunikasi publik,26,1,positif
Sun Mar 24 15:01:55 +0000 2024,kpu putus ghaib akal bulus tutup data real count data mentah csv,-8,-1,negatif
Sun Mar 31 17:19:02 +0000 2024,hasil real count kpu pilpres jawa barat anies baswedan unggul wilayah,5,1,positif
Wed Mar 20 06:47:24 +0000 2024,kpu menang milu maret provinsi provinsi menang paslon prabowogibran breaking news kpu hasil real count milu putar,13,1,positif
Wed Apr 03 12:03:16 +0000 2024,sengketa kait data real count milu bentuk mentah rincian infrastruktur it kpu kontrak kpu alibaba cloud data daftar pilih dpt level kelurahandesa,0,0,netral
Wed Apr 24 08:09:29 +0000 2024,barusan update data lagulagu karya publisher nyata lagu april emang real count lho quick count manipulasi wkwkwk tunggu orang cibir pandemi challenge bikin karya,7,1,positif
Mon Mar 18 10:37:58 +0000 2024,komisioner id pecat ri,-5,-1,negatif
Wed Feb 14 06:41:00 +0000 2024,lapor warga surat suara coblos fakta amp bukti curang quick count ambisi menang curang,-4,-1,negatif
Wed Feb 14 08:14:07 +0000 2024,dear pilih aceh anggap kau berani,0,0,netral
Wed Feb 14 13:00:08 +0000 2024,serbaserbi selamat prabowogibran,8,1,positif
Wed Feb 14 06:00:23 +0000 2024,serba serbi milu recap jenis drama kalang tweet update besok a thread,-4,-1,negatif
Wed Feb 14 20:22:27 +0000 2024,,0,0,netral
Wed Feb 14 11:02:31 +0000 2024,anies baswedan tanggap hasil quick count pilpres,6,1,positif
Wed Feb 14 05:19:39 +0000 2024,bapa gue ngakak banget tps disurakin pilih gemoy ya garagara pakai kaos biru also bapa iyahhh bwoong,3,1,positif
Wed Feb 14 22:47:36 +0000 2024,jam mari tidur,7,1,positif
Wed Feb 14 22:08:08 +0000 2024,nyoblos grepe grepe ya,4,1,positif
Wed Feb 14 06:18:47 +0000 2024,lihat hasil quick count via website unggul provinsi papua papua daerah indonesia erat isu ham unik tarik,7,1,positif
Wed Feb 14 21:53:15 +0000 2024,malem habis kerja iseng buka web kpu coba lihat hasil suara tps kampung medan eh nemu hasil input beda form c lolos approvernya kah amin pragib gama sesuai form c,15,1,positif
Wed Feb 14 22:50:48 +0000 2024,bgsd quickcount panik loh astaga sgini doang warga x kmana kmaren yg koar koar pgn ubah quickcount panik,-4,-1,negatif
Wed Feb 14 21:02:00 +0000 2024,keren harap emangyess pbwogbran bangun infrastruktur dorong makmur masyarakat jgnlupa fotohasilnya,7,1,positif
Wed Feb 14 21:04:00 +0000 2024,top emangyess pbwogbran ruang orang muda prestasi makmur rakyat jgnlupa fotohasilnya,4,1,positif
Wed Feb 14 06:24:50 +0000 2024,jaksel tegal temu surat suara coblos madura parah desa undang sebar surat suara coblos rumah ketua kpps bakar,3,1,positif
Wed Feb 14 09:37:48 +0000 2024,terima kasih hak pilih pilih pdi juang dukung pdi juang juang suara rakyat,15,1,positif
Wed Feb 14 23:36:34 +0000 2024,,0,0,netral
Wed Feb 14 23:24:13 +0000 2024,pagi gass tps cisaranten kulon arcamanik prabowo sirekap kpu salah input,-3,-1,negatif
Wed Feb 14 21:26:19 +0000 2024,serba serbi,0,0,netral
Wed Feb 14 21:43:52 +0000 2024,buset jam gin selesai sehatsehat kpps saksi,3,1,positif
Wed Feb 14 23:29:36 +0000 2024,tps cibuntu bandung kulon kota bandung prabowo nambah sirekap kpu salah input,-7,-1,negatif
Wed Feb 14 23:34:12 +0000 2024,tps gumuruh batununggal kota bandung prabowo nambah sirekap kpu salah input,-6,-1,negatif
Wed Feb 14 23:14:16 +0000 2024,kontribusi data suara org,-1,-1,negatif
Wed Feb 14 23:20:16 +0000 2024,pamit undur jam terimakasih ucapakan bos markifer nanang akhmad,10,1,positif
Wed Feb 14 23:35:33 +0000 2024,tps kebon gedang batununggal anies prabowo ganjar sirekap kpu salah input,-3,-1,negatif
Wed Feb 14 23:46:18 +0000 2024,tps pakemitan cinambo kota bandung prabowo nambah sirekap kpu salah input,-6,-1,negatif
Wed Feb 14 23:44:27 +0000 2024,tps babakan penghulu cinambo kota bandung prabowo nambah anies korting sirekap kpu salah input,-6,-1,negatif
Wed Feb 14 07:47:49 +0000 2024,menteri jokowi kompak pakai hitam nyoblos tps,-4,-1,negatif
Wed Feb 14 23:37:32 +0000 2024,tps suka asih bojongloa kaler kota bandung prabowo nambah sirekap kpu salah input,0,0,netral
Wed Feb 14 21:39:59 +0000 2024,coklat valentine minat kenyang makan janji manis calon dpd dpr calon presiden,16,1,positif
Wed Feb 14 23:59:44 +0000 2024,tps cihampelas bandung barat prabowo nambah sirekap kpu salah input,-5,-1,negatif
Wed Feb 14 23:53:13 +0000 2024,tps sindang jaya mandalajati kota bandung prabowo nambah sirekap kpu salah input,-2,-1,negatif
Wed Feb 14 23:31:40 +0000 2024,tps cigondewah kaler kota bandung prabowo nambah sirekap kpu salah input,-6,-1,negatif
Wed Feb 14 23:56:49 +0000 2024,tps batujajar barat batujajar bandung barat prabowo nambah sirekap kpu salah input,-5,-1,negatif
Wed Feb 14 23:51:12 +0000 2024,tps kebon kangkung kiaracondong kota bandung prabowo sirekap kpu salah input,-6,-1,negatif
Wed Feb 14 23:19:31 +0000 2024,promo,3,1,positif
Wed Feb 14 23:40:24 +0000 2024,tps kejat buahbatu kota bandung prabowo nambah sirekap kpu salah input,-6,-1,negatif
Wed Feb 14 23:49:11 +0000 2024,tps babakan surabaya kiaracondong kota bandung anies nambah prabowo sirekap kpu salah input,-6,-1,negatif
Wed Feb 14 23:04:06 +0000 2024,kerja jam mensukseskan demokrasi eh rusak demokrasi,5,1,positif
Wed Feb 14 22:02:45 +0000 2024,mantau twitter berita surat suara coblos duluan paslon ya eror sirekap kpu markup suara paslon gilaan wkwkw nemu markup paslon gamau asumsi nyata ya wkwkw,1,1,positif
Wed Feb 14 23:35:32 +0000 2024,buzzerp main hestek,2,1,positif
Wed Feb 14 20:59:52 +0000 2024,tunggu c salin kayak tunggu jodoh,5,1,positif
Wed Feb 14 20:25:07 +0000 2024,kpps selesai hitung jam setor camat jam tidur nanggung,6,1,positif
Wed Feb 14 23:29:35 +0000 2024,bangun tidur kayak orang habis putus nggak sakit hampa level energi angka,0,0,netral
Wed Feb 14 22:19:46 +0000 2024,mari tunggu hasil berwewenang jaga damai laksana milu polri poldapb,10,1,positif
Wed Feb 14 22:08:43 +0000 2024,heran milu kali menang paslon prabowogibran pangku kuasa ri heran milu menang paslon amin kalah orang nomor indonesia back to natural democracy,19,1,positif
Wed Feb 14 22:34:48 +0000 2024,banteng jokowi menang milu periode,1,1,positif
Wed Feb 14 23:09:08 +0000 2024,prabowo kampanye selesai,5,1,positif
Wed Feb 14 23:11:13 +0000 2024,quincy promes vonis penjara selundup kokain,-4,-1,negatif
Wed Feb 14 20:32:39 +0000 2024,status warga sipil eks jenderal polisi perdana salur hak pilih,-5,-1,negatif
Wed Feb 14 22:58:45 +0000 2024,jokowi effect signifikan suara golkar amp demokrat,2,1,positif
Wed Feb 14 23:46:01 +0000 2024,kena prank jokowi udah capekcapek dukung jokowi ujungujungnya prabowo rip demokrasi real count,-2,-1,negatif
Wed Feb 14 21:20:42 +0000 2024,dah teori demokrasi batas teori kalah teori makan gratis hilir cerita cucu demokrasi era modern modern globalisasi reformasi coba,9,1,positif
Wed Feb 14 23:25:21 +0000 2024,kalo dipikir katakata pintar intelek by data katakata konotasi negatif ya panggil profesor buah insult ya salah subjektif bukti jari,-8,-1,negatif
Wed Feb 14 10:34:12 +0000 2024,tangis dukung pecah iring anies tinggal posko menang,4,1,positif
Wed Feb 14 08:12:10 +0000 2024,prabowogibran menang rutan koruptor milu,4,1,positif
Wed Feb 14 20:36:14 +0000 2024,gw heran yg ngetweet curang dll paham sistem hitung milu sih yg debatin dri loh,-4,-1,negatif
Wed Feb 14 23:02:42 +0000 2024,milu manual gin jaman canggih era digital,-2,-1,negatif
Wed Feb 14 21:03:07 +0000 2024,bangun garagara ganti presiden,6,1,positif
Wed Feb 14 23:39:37 +0000 2024,rutin kemoterapi sayang tumor nya negara gagal hancur ekonomi politik sebar luas rakyat konsentrasi kelompok kuasa daron acemoglu,-5,-1,negatif
Wed Feb 14 21:27:02 +0000 2024,semangat omaygat,4,1,positif
Wed Feb 14 22:29:26 +0000 2024,,0,0,netral
Wed Feb 14 23:10:40 +0000 2024,data c masuk ayo guys upload c tps daerah,-1,-1,negatif
Wed Feb 14 22:50:27 +0000 2024,push day done stock buah isi ulang nyoblos milu buruh yuk kerja yuk,14,1,positif
Wed Feb 14 23:46:41 +0000 2024,terima kasih tugas kpps tugas jalan milu tidur jam hebat,5,1,positif
Wed Feb 14 22:39:18 +0000 2024,pdip kayak digdaya partai capresnya nomor buncit nasdem pks pkb kayak moncer capresnya partai jual foto bareng presiden jabat kayak lolos parliamentary treshold ya,-1,-1,negatif
Wed Feb 14 23:13:36 +0000 2024,tps mengwi badung bal prabowo nambah sirekap kpu salah input,-8,-1,negatif
Wed Feb 14 23:28:55 +0000 2024,promo,3,1,positif
Wed Feb 14 22:02:40 +0000 2024,terima kasih hak pilih pilih pdi juang dukung pdi juang juang suara rakyat,15,1,positif
Wed Feb 14 23:21:45 +0000 2024,tunggu pose pegang bola jersey bola,2,1,positif
Wed Feb 14 23:07:23 +0000 2024,pilih tps ratarata orang kandidat raih suara mesti keliru ya,4,1,positif
Wed Feb 14 23:17:11 +0000 2024,,0,0,netral
Wed Feb 14 21:19:01 +0000 2024,kawal suara,3,1,positif
Wed Feb 14 22:43:18 +0000 2024,dukung diam amp olah olah dukung milu dukung milu,13,1,positif
Wed Feb 14 23:52:10 +0000 2024,sedih menang sedih psi masuk senayan,-9,-1,negatif
Wed Feb 14 22:55:19 +0000 2024,gue bilang menang,4,1,positif
Wed Feb 14 23:41:19 +0000 2024,putus rasmi pilih raya subianto caloncalon suruhanjaya pilih raya prabowo undi lepas kirakira enam ratus undi,-3,-1,negatif
Wed Feb 14 02:01:20 +0000 2024,nyoblos parfum yg ajaaaaa bener dooong cek instagram story scentplusofficial template story ramai pakai template nya foto coblos tag instagram,5,1,positif
Wed Feb 14 23:10:56 +0000 2024,day my st time jakarta congratulation tweet id,0,0,netral
Wed Feb 14 23:37:19 +0000 2024,berkat jokowi prabowo image pimpin tulus mata coblos alas orang dukung tulus orang bilang tulus hasil rebranding singkat,13,1,positif
Wed Feb 14 22:23:40 +0000 2024,milu kali rusuh banget dukung paslon serang tl garagara beda antem bhkan cerai wtf negara berketuhanan kalo deh pilih ya entar hasil serah tuhan,2,1,positif
Wed Feb 14 22:29:43 +0000 2024,yg bilang hasil milu transparan gue bekep ye mulut lo gue ptps kpps benr rill ngitungin surat suara sah sah surat suara rusak pisahin benarbenar saksi saksi partai benarbenar hasil rill mata lihat,18,1,positif
Wed Feb 14 22:11:51 +0000 2024,error,-5,-1,negatif
Wed Feb 14 22:48:14 +0000 2024,sesuai ramal r soekarno oeharto j habibie bdurahman wahid oekarno putri ambang yudhoyono okowi dodo owo subianto anjar pranowo ibran rakabuming raka us murti yudhoyono,1,1,positif
Wed Feb 14 23:39:37 +0000 2024,yg tarik hasil quick count suara pdip sumber suara nomor presentase suara banding partai suara arti suara pdip solid lucu,22,1,positif
Wed Feb 14 20:26:33 +0000 2024,timelineku isi akun alter orangorang berani speakup base fess pakai akun pribadi biar seru,8,1,positif
Wed Feb 14 23:45:09 +0000 2024,sehatsehat pahlawan,0,0,netral
Wed Feb 14 22:26:29 +0000 2024,sejati awas milu bawaslu netizen,7,1,positif
Wed Feb 14 23:44:46 +0000 2024,bangun demokrasi,0,0,netral
Wed Feb 14 23:19:43 +0000 2024,milu menang prospek,7,1,positif
Wed Feb 14 23:10:31 +0000 2024,prabowogibran unggul gugus pulau,-4,-1,negatif
Wed Feb 14 23:10:24 +0000 2024,milu mari fokus kerja,9,1,positif
Wed Feb 14 23:35:05 +0000 2024,prabowo rangkul unsur,-3,-1,negatif
Wed Feb 14 23:10:17 +0000 2024,kawal hitung suara aniesmuhaimin bawa gerak ubah,5,1,positif
Wed Feb 14 23:43:21 +0000 2024,jadwal hasil milu sumpahjanji presiden wakil presiden,9,1,positif
Wed Feb 14 22:28:46 +0000 2024,penasaran bursa saham efek sentimen negatif positif hehehe,1,1,positif
Wed Feb 14 23:10:28 +0000 2024,odgj solo coblos milu,2,1,positif
Wed Feb 14 22:38:18 +0000 2024,unsur nista hadap agama islam tragedi bismillah laku curang,-10,-1,negatif
Wed Feb 14 22:42:32 +0000 2024,coba ulang video si tukang coblos arah paku psalon colek ri id,1,1,positif
Wed Feb 14 22:01:22 +0000 2024,pdip oposisi hasto kristiyanto tunggu hitung resmi kpu,1,1,positif
Wed Feb 14 21:58:40 +0000 2024,bentuk timsus investigasi pdip prediksi serang paslon,3,1,positif
Wed Feb 14 23:02:25 +0000 2024,perangkat desa tewas sengat alir listrik tps jember,1,1,positif
Wed Feb 14 21:59:44 +0000 2024,antre nyoblos tps sepeda motor gadis cantik gasak maling,-3,-1,negatif
Wed Feb 14 23:35:19 +0000 2024,masyarakat indonesia phnom penh laku coblos suara milu kbri sabtu februari,2,1,positif
Wed Feb 14 21:00:12 +0000 2024,tps nya kayak lomba bersih kelas hias pakai dresscode gerah a janji beli batik kainya gbgera gerah,-11,-1,negatif
Wed Feb 14 23:42:37 +0000 2024,lihat dukung tweet tweet impact over euforia,7,1,positif
Wed Feb 14 21:40:35 +0000 2024,prabowo subianto tuduh langgar ham pecat angkat darat pilih presiden figur kuasa orba debat simak profil,12,1,positif
Wed Feb 14 23:36:17 +0000 2024,selamat ya pilpres kpu repotrepot bikin sesi debat capres ya hemat anggar ajak mikir,26,1,positif
Wed Feb 14 23:08:16 +0000 2024,hasil real count kpu milu,5,1,positif
Wed Feb 14 19:41:18 +0000 2024,selesai pesta demokrasi warga nkri tunggu pesta demokrasi wota nkri alias om jot info ssk kapaaaaan,8,1,positif
Wed Feb 14 20:33:50 +0000 2024,ih biar seru putar juang org,9,1,positif
Tue Feb 13 17:52:58 +0000 2024,kpu kab manokwari sabtu laksana lepas distribusi logistik milu kantor kpu provinsi papua barat distribusi logistik distrik prafi masni sidey,4,1,positif
Tue Feb 13 18:42:16 +0000 2024,h skd babat tobk go catat tiu fa review latsol kbm ngantuk samsek tidur siangg minum kopi dengar lagu jedag jeduq rest well selamat pilih kpu,5,1,positif
Tue Feb 13 15:57:43 +0000 2024,kpu sangihe laku distribusi logistik milu camat tahuna timur selasa,3,1,positif
Tue Feb 13 13:44:49 +0000 2024,rangka logistik milu kpu kabupaten sumba timur laksana distribusi logistik milu kabupaten sumba timur,3,1,positif
Tue Feb 13 17:46:08 +0000 2024,kpu sangihe laksana musnah surat suara rusak surat suara milu selasa,2,1,positif
Tue Feb 13 15:44:49 +0000 2024,musnah surat suara milu buleleng singaraja komisi pilih kpu kabupaten buleleng laksana musnah surat suara milu gudang logistik kpu buleleng jl dewata iii paron singaraja,-5,-1,negatif
Tue Feb 13 16:54:54 +0000 2024,penandatanganan janji kerjasama kpu sangihe pt bank rakyat indonesia sedia jasa layan bank laksana tahap pilkada selasa,11,1,positif
Tue Feb 13 15:07:49 +0000 2024,selasa kpu kabupaten enrekang laksana forum jurnalis sosialisasi didik pilih rangka tingkat partisipasi pilih milu penyebarluasan informasi berita putar milu serentak,6,1,positif
Tue Feb 13 11:12:21 +0000 2024,artikel kpu milu tanggal februari karrna sesuai simulasi muat laman resmi id turun gue akses baca statemen ketua kpu hasyim asyari,3,1,positif
Tue Feb 13 16:43:10 +0000 2024,kpu provinsi dki jakarta buka call center layan milu sedki jakarta putar milu hubung nomor ya,10,1,positif
Tue Feb 13 12:00:21 +0000 2024,mosok garagara exit poll ganjar mahfud menang kpu panik moga nular indonesia februari tuju rt,9,1,positif
Tue Feb 13 19:34:51 +0000 2024,kpu kabupaten cianjur terima kunjung kerja anggota komisi i dprd provinsi jawa barat rangka pantau laksana milu kabupaten cianjur kantor kpu kabupaten cianjur selasa,9,1,positif
Tue Feb 13 19:14:23 +0000 2024,februari ayo tps hak pilih pungut suara milu serentak golput,7,1,positif
Tue Feb 13 20:22:39 +0000 2024,area gudang logistik kpu kabupaten cianjur laksana musnah surat suara rusak milu selasa ketua divisi hukum awas kpu kabupaten cianjur misbahudin,7,1,positif
Tue Feb 13 13:51:26 +0000 2024,halo selasa kpu kabupaten rangin terima kunjung wakapolda jambi brigjen pol edi mardianto sik kesiap selenggara milu personil polisi aman lengkap milu beliau,8,1,positif
Tue Feb 13 15:07:03 +0000 2024,selasa kpu kabupaten enrekang laku musnah surat suara pilih gudang logistik kpu kabupaten enrekang,-5,-1,negatif
Tue Feb 13 13:06:40 +0000 2024,ketua id ya orang dokumentasi chasil hitung suara besok kalo larang pkpu no pasal buku pandu kpps video pidato ketu,3,1,positif
Tue Feb 13 11:39:22 +0000 2024,kpu kota prabumulih laksana lepas distribusi logistik pilih serentak gudang logistik kpu kota prabumulih gudang logistik panitia pilih camat ppk,1,1,positif
Tue Feb 13 15:52:58 +0000 2024,kpu kabupaten seluma laksana distribusi logistik pilih camat kabupaten seluma tanggal sd februari,-3,-1,negatif
Tue Feb 13 13:50:00 +0000 2024,pesan ketua kpu hasyim asyari besok pilpres februari pulang hitung saksi kontrol proses pungut suara lupa hitung suara coret kertas suara pakai,15,1,positif
Tue Feb 13 19:00:33 +0000 2024,komisi pilih kpu jeneponto musnah surat suara sisa laku sortir epak milu,-6,-1,negatif
Tue Feb 13 13:45:11 +0000 2024,kpu kota prabumulih laksana giat musnah surat suara pilih gudang logistik kpu kota prabumulih,-7,-1,negatif
Tue Feb 13 15:56:26 +0000 2024,fix ye id rakyat dokumentasi giat proses hitung tps plin plan pagi tempe sore kedele mari kawal pemilupilpres,8,1,positif
Tue Feb 13 09:46:19 +0000 2024,video proses distribusi logistik milu lokasi tps sulit desa langgar jaya camat mani ilir tps damar kencana desa sosok taba camat muara kemumu milu sarana integrasi bangsa,19,1,positif
Tue Feb 13 14:17:31 +0000 2024,selasa tanggal februari kpu kabupaten kepahiang laku distribusi logistik milu tps kotak mobil engkel pick up,-3,-1,negatif
Tue Feb 13 23:35:04 +0000 2024,selasa malam februari ketua kpu kota metro nurris septa pratama tim memonitoring kesiap tpstps wilayah kota metro ri lampung,-7,-1,negatif
Tue Feb 13 16:58:15 +0000 2024,komisi pilih kpu kota bekas laksana lantik ganti antarwaktu paw anggota panitia pungut suara pps kel jatibening pilih senin,10,1,positif
Tue Feb 13 14:25:32 +0000 2024,kpu kabupaten gorontalo gelar giat musnah surat suara rusak milu tingkat kpu kabupaten gorontalo langsung halaman kantor kpu kabupaten gorontalo selasa,6,1,positif
Tue Feb 13 19:35:07 +0000 2024,kabupaten cianjur ketua kpu kabupaten cianjur logistik milu tps kabupaten cianjur kpu kabupaten,0,0,netral
Tue Feb 13 16:59:55 +0000 2024,ketua kpu kota bekas ali syaifa as buka giat bimbing teknis pungut hitung suara rekapitulasi hitung hasil suara hasil milu hotel horizon ultima bekas selasa,26,1,positif
Tue Feb 13 08:25:48 +0000 2024,kpu kabupaten magetan musnah ribu lembar surat suara milu serentak rusak bakar selasa gudang logistik milu kpu kabupaten magetan,4,1,positif
Tue Feb 13 14:33:31 +0000 2024,tuju milu serentak tanggal februari yuk simak pesan agus arifin ketua kpu provinsi sumatera utara milu serentak,14,1,positif
Tue Feb 13 23:55:43 +0000 2024,rabu februari pungut suara milu serentak ayo tps hak pilih,7,1,positif
Tue Feb 13 13:17:17 +0000 2024,barusan simak presscon id jelang pungut suara esok inti poin ketua id ya orang dokumentasi chasil hitung suara besok kalo larang pkpu no pasal buku pandu kpps video,14,1,positif
